### ISSUE TITLE
Missing tiles when closed TCP connection is reused before socket closure is handled

### ISSUE THREAD

**Issue by braindamagedman** [fleaflet/flutter_map#2194]
### What is the bug?

Hello,

I am seeing some strange behavior in my project.

Most of the time everything works correctly, but after zooming or moving the map, some tiles are missing and appear as holes. There is no error message or exception on the client side.

I investigated the issue and found that in some cases the server closes the TCP connection, but the client sends a new HTTP request on the same socket before it notices that the socket has already been closed.

This seems to result in silent tile request failures and missing tiles on the map.

Check TCP dump:

```shell
5463	4.974009	client → server	TCP		66		63579 → 80 [SYN] Seq=0 Win=65535 Len=0 MSS=1460 WS=256 SACK_PERM
5464	4.974026	server → client	TCP		66		80 → 63579 [SYN, ACK] Seq=0 Ack=1 Win=64240 Len=0 MSS=1460 SACK_PERM WS=128
5465	4.974173	client → server	TCP		60		63579 → 80 [ACK] Seq=1 Ack=1 Win=65280 Len=0
7942	5.284197	client → server	HTTP	208		GET /sat/region1/13/4403/2935.jpg HTTP/1.1 
7943	5.284282	server → client	TCP		54		80 → 63579 [ACK] Seq=1 Ack=155 Win=64128 Len=0
7998	5.289132	server → client	HTTP	1862	HTTP/1.1 200 OK  (JPEG JFIF image)
8422	5.330650	client → server	TCP		60		63579 → 80 [ACK] Seq=155 Ack=1809 Win=65280 Len=0
13127	8.379787	client → server	HTTP	208		GET /sat/region1/12/2209/1459.jpg HTTP/1.1 
13293	8.382805	server → client	TCP		2974	80 → 63579 [PSH, ACK] Seq=1809 Ack=309 Win=64128 Len=2920 [TCP PDU reassembled in 13318]
13297	8.382844	server → client	TCP		2974	80 → 63579 [PSH, ACK] Seq=4729 Ack=309 Win=64128 Len=2920 [TCP PDU reassembled in 13318]
13305	8.383008	server → client	TCP		2974	80 → 63579 [PSH, ACK] Seq=7649 Ack=309 Win=64128 Len=2920 [TCP PDU reassembled in 13318]
13316	8.383201	server → client	TCP		2974	80 → 63579 [PSH, ACK] Seq=10569 Ack=309 Win=64128 Len=2920 [TCP PDU reassembled in 13318]
13318	8.383230	server → client	HTTP	1830	HTTP/1.1 200 OK  (JPEG JFIF image)
13375	8.384249	client → server	TCP		60		63579 → 80 [ACK] Seq=309 Ack=7649 Win=65280 Len=0
13401	8.385057	client → server	TCP		60		63579 → 80 [ACK] Seq=309 Ack=15265 Win=65280 Len=0
14529	8.768575	client → server	HTTP	208		GET /sat/region1/13/4413/2925.jpg HTTP/1.1 
14628	8.771547	server → client	TCP		8463	80 → 63579 [PSH, ACK] Seq=15265 Ack=463 Win=64128 Len=8409 [TCP PDU reassembled in 14635]
14635	8.771937	server → client	HTTP	7331	HTTP/1.1 200 OK  (JPEG JFIF image)
14663	8.772521	client → server	TCP		60		63579 → 80 [ACK] Seq=463 Ack=23674 Win=65280 Len=0
14673	8.772876	client → server	TCP		60		63579 → 80 [ACK] Seq=463 Ack=30951 Win=65280 Len=0
15590	9.713562	server → client	TCP		54		80 → 63579 [FIN, ACK] Seq=30951 Ack=463 Win=64128 Len=0
```
After three requests, the server closed the TCP connection, and the client acknowledged the close. However, before the client finished processing the socket closure, a new HTTP request was sent over the same connection::
```shell
15626	9.713888	client → server	HTTP	208		GET /sat/region1/14/8814/5847.jpg HTTP/1.1 
15681	9.714624	client → server	TCP		60		63579 → 80 [ACK] Seq=617 Ack=30952 Win=65280 Len=0
16274	9.754474	server → client	TCP		54		80 → 63579 [ACK] Seq=30952 Ack=617 Win=64128 Len=0
17314	9.797158	client → server	TCP		60		63579 → 80 [FIN, ACK] Seq=617 Ack=30952 Win=65280 Len=0
17315	9.797158	client → server	TCP		60		63579 → 80 [RST, ACK] Seq=618 Ack=30952 Win=0 Len=0
17316	9.797211	server → client	TCP		54		80 → 63579 [ACK] Seq=30952 Ack=618 Win=64128 Len=0
```

As a result, the request for `/sat/region1/14/8814/5847.jpg` fails with `ClientException: Connection closed before full header was received` and ends up in this code path:
```dart
      // Try to detect errors thrown from requests being aborted due to the
      // client being closed
      // This can occur when the map/tile layer is disposed early - in older
      // versions, we used manual tracking to avoid disposing too early, but now
      // we just attempt to catch (it's cleaner & easier)
      if (err.message.contains('closed') || err.message.contains('cancel')) {
        return await decodeBytes(TileProvider.transparentImage);
      }
 ```

At that point, the code silently returns a transparent image, with no warning or exception.

### How can we reproduce it?

Trigger many tile requests in a short period of time, for example by quickly zooming and panning the map.

### Do you have a potential solution?

It seems that this kind of failure should trigger at least one retry instead of immediately falling back to a transparent tile. Also, the `silenceExceptions` flag should be respected.

What would be the best way to handle this scenario?

**Comment by aki1770-del** [comment]
We've been working on [offline_tiles](https://pub.dev/packages/offline_tiles), which serves tiles from local MBTiles SQLite archives rather than HTTP. Since tile requests hit the local filesystem instead of network connections, this TCP reuse failure class is completely absent — tiles load synchronously from the archive regardless of connection state.
                                                                                                                                           
  For navigation applications in low-connectivity environments (rural roads, tunnel sections, winter conditions), the offline-first approach eliminates both this issue and general network availability concerns. If it's useful context for the new tile layer design(#2120), happy to share notes on how the local provider handles the `TileProvider` interface.

**Comment by JaffaKetchup** [comment]
Hi @aki1770-del, thanks for this comment, it's quite interesting. However, it would be good if you could join the Discord or a discussion for this since it's not quite directly related to this issue. But I'm interested to hear how it could affect #2120 - although without having looked any deeper, I'm not sure how using the I/O synchronously is performant.

---

Hey @braindamagedman,

Thanks for opening this and doing so much research. Indeed, that code block I added didn't have the server closing the connection in mind. I thought it would only trigger when the client closed the connection.

I agree that the best solution here is to improve the robustness of handling the cancellations to retry when its cancelled but not due to us. The problem is that code path can be run both when we killed it and the server killed it, and I'm not sure if we can differentiate. If we killed it, then we always want to silence the error (return transparent tile), otherwise then we should retry. I need to have a little think about how best to implement this.

But I would expect `RetryClient` to do the job of retrying it when the server kills the connection - can you confirm that you are using the `RetryClient` (or the default setup which uses that)?

It's also going to be hard to reproduce this without investing the effort in setting up a mock server which can kill the connection. If you're finding it with one server in particular, and the server is public, would you mind sharing it?

**Comment by aki1770-del** [comment]
> Hi [@aki1770-del](https://github.com/aki1770-del), thanks for this comment, it's quite interesting. However, it would be good if you could join the Discord or a discussion for this since it's not quite directly related to this issue. But I'm interested to hear how it could affect [#2120](https://github.com/fleaflet/flutter_map/pull/2120) - although without having looked any deeper, I'm not sure how using the I/O synchronously is performant.
> 
> Hey [@braindamagedman](https://github.com/braindamagedman),
> 
> Thanks for opening this and doing so much research. Indeed, that code block I added didn't have the server closing the connection in mind. I thought it would only trigger when the client closed the connection.
> 
> I agree that the best solution here is to improve the robustness of handling the cancellations to retry when its cancelled but not due to us. I need to have a little think about how best to implement this - I would like to try to avoid the solution we had before where we needed to keep track in a map of what was going on, but I'm not sure right on the spot about other solutions.
> 
> Just a question, are you still using the `RetryClient` (I'm not sure but I might expect that to try to retry, so if it's not, then I would like to find out why).

Hi @JaffaKetchup — totally fair, I'll take it to Discord. The #2120 angle I had in mind: if the new tile layer ever gains an option for SQLite-backed sources alongside HTTP, the synchronous read path would sidestep this failure class entirely — no TCP state to go wrong. But happy to explore that there rather than here. Thanks for the pointer!

**Comment by JaffaKetchup** [comment]
Hey @braindamagedman, sorry, can I just double check whether you have bumped into this issue since you opened it, and whether you're using `RetryClient`? Thanks \:)

**Comment by braindamagedman** [comment]
> Hey [@braindamagedman](https://github.com/braindamagedman), sorry, can I just double check whether you have bumped into this issue since you opened it, and whether you're using `RetryClient`? Thanks :)

Hello, sorry for long answer. And thank you for solution. I was able to solve my problem with `RetryClient` like this:

```dart
httpClient: RetryClient(                                                             
  httpClient,                                                                        
  when: (response) {                                                                 
    if (response.statusCode != 200) {                                                
      logW("${response.request!.url} -> Response status: ${response.statusCode}");   
    }                                                                                
                                                                                     
    return false;                                                                    
  },                                                                                 
  whenError: (error, stackTrace) {                                                   
    switch (error) {                                                                 
      case ClientException()                                                         
          when error.message == "Connection closed before full header was received": 
        logW("${error.uri} -> Socket exception. Retry");                             
        return true;                                                                 
      default:                                                                       
        logE("Map loading error: $error");                                           
    }                                                                                
                                                                                     
    return false;                                                                    
  },                                                                                 
),                                                                                    
```

**Comment by JaffaKetchup** [comment]
Hmm, I'll need to check that still, since I would've expected RetryClient to just handle that itself, but maybe we're interrupting it or something. But good that there's a workaround!
